id;text;target;label;title;university;author;nokia_score;link;nokia_reasons
91;"Elpymistð tukeva monitilatoimisto : restoratiiviset tilaratkaisut ympðrist—psykologian nðk—kulmasta Opinnðytety—n tavoitteena oli kerðtð yhteen sisustusarkkitehtuurin keinoja, jotka edistðvðt ty—pðivðn aikaista elpymistð aivoty—h—n liittyvðstð kognitiivisesta kuormituksesta. Sen taustoituksessa kðsiteltiin kirjallisuuskatsauksen kautta ympðrist—psykologian elpymistð eli restoratiivisuutta tarkastelevia teorioita sekð tuoreimpia tutkimuksia monitilatoimistojen vaikutuksista kðyttðjiensð hyvinvointiin. Tutkimusten mukaan merkittðvimmðt kuormitusta lisððvðt vaikuttavat haasteet monitilatoimistoissa liittyvðt keskittymistð hðiritseviin puheððniin sekð yksityisyyden puutteisiin. 

Sisustusarkkitehtuurin viitekehyksessð restoratiivisuus toteutuu monitilatoimistossa tilaratkaisuina, jotka tukevat mielen virkistymistð ja tarkkaavaisuuden palautumista tiedonkðsittelyð vaativan ty—skentelyn aikana tai sen jðlkeen. Ty—pðivðn aikaista palautumista voidaan edistðð suunnittelemalla rauhallisia tauko- ja lepotiloja, vðhentðmðllð keskittymistð hðiritsevðð ðrsykekuormaa sekð lisððmðllð tiloihin elpymistð tukevia luontoelementtejð. 

Opinnðytety—n lopputuloksena on kuvitteellisen monitilatoimiston konseptitasoinen tilasuunnitelma, jossa keskitytððn edistðmððn ty—pðivðn aikaista elpymistð restoratiivisuutta lisððvien tekij—iden kautta. Opinnðytety—ssð esitetððn monitilatoimiston viitteellinen tilaohjelma sekð elpymistð tukevia sisustus- ja akustiikkaratkaisuja valikoitujen tilojen osalta periaatetasolla.";0;NO_INDICATION_OF_COLLABORATION;Elpymistð tukeva monitilatoimisto : restoratiiviset tilaratkaisut ympðrist—psykologian nðk—kulmasta;Lab UAS;Leinonen, Mari;0;https://www.theseus.fi/handle/10024/910896;"[""No Nokia mention""]"
92;"Strateginen yleiskaava ja kaavoituksen vuorovaikutuksen kehittðminen : tapaus Marttilan kunta The aim of this thesis was to develop planning interaction through a multi-method case study and to examine the potential benefits of a strategic master plan in the municipality of Marttila. 

The theoretical framework of the study consists of land use planning methods and interaction approaches in Finland, particularly in rural areas, as well as process development. Planning interaction methods were identified as residents' access to information, data collection from residents, and dialogical participation. Research data was collected through progressive data collection, beginning with a comparative analysis of master plans from other municipalities. Based on the comparative analysis, a resident survey was conducted. The survey data was further deepened through thematic group interviews with residents. 

Good participation brings stakeholder perspectives into strategic planning and improves the acceptability of strategic choices. Based on the results, the success of participation depends on the experience of personal benefit, sufficient general knowledge about planning, anonymous data collection, consideration of target groups, and a low threshold for participation. The benefits of a strategic master plan were identified as supporting decision-making by elected officials, providing residents with a vision of the future and participation in its planning, as well as resource efficiency. The timing and methods of interaction were described as part of a strategic master plan process model, whose main objective is to clarify the process for all stakeholders.";0;NO_INDICATION_OF_COLLABORATION;Strateginen yleiskaava ja kaavoituksen vuorovaikutuksen kehittðminen : tapaus Marttilan kunta;Lab UAS;Halkola, Kirsi;0;https://www.theseus.fi/handle/10024/902990;"[""No Nokia mention""]"
93;"Tekoðly muutosvoimana strategisessa johtamisessa : johtajan roolin muutos ja siihen valmistautuminen Tðmð opinnðytety— on kuvaileva kirjallisuuskatsaus, jonka tavoitteena on tarkastella, miten tekoðlyn (AI) kðytt——notto muuttaa johtajan roolia strategisessa pððt—ksenteossa ja miten organisaatiot voivat valmistautua nðihin muutoksiin. Ty—ssð analysoidaan viime vuosina julkaistua tieteellistð kirjallisuutta ja tutkimuksia, jotka kðsittelevðt tekoðlyn tuomia mahdollisuuksia ja haasteita organisaation ylimmðlle johdolle.  

Katsauksen perusteella tekoðly ei toimi ainoastaan pððt—ksentekoa tukevana ty—kaluna, vaan strategisena muutosvoimana, joka muokkaa johtajuuden luonnetta, osaamisvaatimuksia ja pððt—ksenteon prosesseja. Tekoðlyn hy—dyntðminen laajentaa strategisia vaihtoehtoja ja auttaa kohdistamaan toimenpiteitð entistð tarkemmin, mutta edellyttðð samanaikaisesti eettistð harkintaa, teknologista ymmðrrystð ja ihmisen sekð koneen vahvuuksien yhteensovittamista.   

Tulokset osoittavat, ettð johtajien rooli ei vðhene tekoðlyn kehittyessð, vaan sen painopiste siirtyy yhð enemmðn strategisen suunnan mððrittðmiseen, organisaatiokulttuurin rakentamiseen ja luottamuksen vahvistamiseen teknologian kðyt—ssð.  

Opinnðytety—n tarkoituksena on tuottaa ajankohtaista tietoa tekoðlyn ja strategisen johtamisen rajapinnasta sekð antaa suosituksia siitð, miten organisaatiot ja johtajat voivat valmistautua tekoðlyn tuomiin johtamisen muutoksiin.";0;NO_INDICATION_OF_COLLABORATION;Tekoðly muutosvoimana strategisessa johtamisessa : johtajan roolin muutos ja siihen valmistautuminen;Lab UAS;Ripatti, Eini;0;https://www.theseus.fi/handle/10024/906212;"[""No Nokia mention""]"
94;"The impact of the language barrier on skilled and qualified spouses of immigrant students in Lahti, Finland Finland's current socioeconomic environment increasingly relies on hiring foreign talent to offset the growing labour market shortages. Nevertheless, the language barrier creates challenges that adversely affect immigrants integration into Finnish society.  

This bachelor's thesis aimed to explore the impact of the language barrier on skilled and qualified spouses of immigrant students in Lahti, Finland. It highlights the growing dependency on foreign nationals to mitigate labour deficiencies, and the critical role of language proficiency plays in the integration of these immigrants. 

The author employed an inductive content analysis method, which was conducted with a combination of questionnaires and interviews, with the assistance of the local Employment and Economic Development Office and International House Lahti. This facilitated uncovering emerging patterns and trends systematically collected and analysed to address the research question and develop practical recommendations.  

The findings revealed significant challenges foreign nationals face due to language barriers in the Finnish labour market, including a lack of language training opportunities, equalisation of previously obtained qualifications to Finnish standards, and intercultural differences. The findings emphasised the critical need for effective language support mechanisms and interventions to ensure the effective integration of qualified spouses into the Finnish labour market, highlighting the importance of strategies like language training and cultural competency programs.";0;NO_INDICATION_OF_COLLABORATION;The impact of the language barrier on skilled and qualified spouses of immigrant students in Lahti, Finland;Lab UAS;Karunaratne, Dinesha;0;https://www.theseus.fi/handle/10024/894741;"[""No Nokia mention""]"
95;"Exploring dropping out trends and career outcomes of Bangladeshi IT students in Finnish universities of applied sciences : challenges and insights The thesis rigorously examined the dropout trends and post-study career trajectories of Bangladeshi IT students enrolled in universities of applied sciences (UAS) in Finland. Its primary objective was to identify the fundamental challenges contributing to academic discontinuation and to understand how these students navigate their careers following either the cessation or completion of their studies. A mixed research methodology was employed. A survey was conducted online using Google Forms. Additionally, semi-structured face-to-face interviews were conducted with some students to cross-check the data obtained online. Students from various UAS expressed their experiences. 

The findings indicate that financial difficulties, challenges in securing internships, language barriers, elevated tuition fees, and insufficient academic support contribute to student dropout rates. Despite these obstacles, a subset of students has completed their degrees; however, most still face unemployment. 

The study concludes that the development of participatory education, as opposed to self-study, alongside the provision of scholarships and internship support, as well as the assurance of cooperation concerning culture and language, may contribute to a reduction in dropout rates and an enhancement of the career success rate for Bangladeshi students.";0;NO_INDICATION_OF_COLLABORATION;Exploring dropping out trends and career outcomes of Bangladeshi IT students in Finnish universities of applied sciences : challenges and insights;Lab UAS;Jui, Papia Islam;0;https://www.theseus.fi/handle/10024/895793;"[""No Nokia mention""]"
96;"Festivaaliyrityksen asiakassegmentointi : case: Festivaali X The purpose of the study was to gather deeper insights into the events visitors and to develop a customer segmentation for the company. Customer segmentation enables the company to gain a clearer understanding of festival attendees and to tailor its services more effectively to meet their needs. The study aimed to explore the needs and purchasing behavior of festival visitors, as well as to analyze the gender distribution of attendees.

The research combined qualitative and quantitative methods. Qualitative data were gathered through on-site personal interviews with 16 festival visitors, while quantitative data came from a customer survey and gender distribution analysis. The survey, which was open for just over a week, received 232 responses. Gender distribution results revealed that on the first day of the festival, 2 440 female visitors and 1 682 male visitors attended, which represents 45,1 % more female than male attendees. Through customer segmentation, five customer segments were formed, each represented by a customer persona.";0;NO_INDICATION_OF_COLLABORATION;Festivaaliyrityksen asiakassegmentointi : case: Festivaali X;Lab UAS;Eronen, Ada;0;https://www.theseus.fi/handle/10024/897785;"[""No Nokia mention""]"
97;"Entering the handicrafts in Finnish market : case company: Sabita Kapada Udhyog This thesis explored the potential market for Sabita Kapada Udhyog to introduce authentic Nepali handicrafts into the Finnish market. The motivation behind this study was to understand whether there is a real interest and demand for these unique, handmade products among Finnish consumers. To find out the answer of this, both primary and secondary research data collecting methods was used. A survey was conducted among residents living in Finland. With a primary focus upon business students from LAB University of Applied Sciences, to gather firsthand insights data. Secondary data was collected from the trusted reports and published studies related to handicrafts, consumer behaviour, and trade. 

The research showed a growing interest and appreciation for ethically made, culturally rich products in Finland, especially among young consumers living in urban centres like Helsinki. Many respondents indicated and openness toward Nepali handicrafts and suggesting a promising market. The study also highlighted key factors that Nepali exporters should consider, such as understanding consumer preferences and the competitive environment in Finland. 

In conclusion, the findings indicate that there is a real opportunity for Sabita Kapada Udhyog to expand its products in Finland. However, the success will depend on understanding local preferences and building strong connections with customers. Overall, the Finnish market shows good potential for Nepali handicrafts, especially among ethically conscious customers who value authenticity and artisanry.";0;NO_INDICATION_OF_COLLABORATION;Entering the handicrafts in Finnish market : case company: Sabita Kapada Udhyog;Lab UAS;Shakya, Sudina;0;https://www.theseus.fi/handle/10024/896521;"[""No Nokia mention""]"
98;"Tulevaisuusmuotoilu : osaamisen ennakointi ammatillisessa koulutuksessa This research-based development project has created a foresight method grounded in design thinking and strategic design to anticipate future skill needs in vocational education. The objective has been to develop a practical method to support curriculum planning and collaboration between vocational institutions and the world of work by identifying companies future skill requirements and addressing them through education. 

The method is structured in phases and incorporates tools such as company interviews, PESTEL analysis, scenario development and AI-assisted data processing. The development work has been carried out in collaboration with representatives from educational institutions and companies. 

As a result, a practical method for anticipating vocational skills needs has been developed. It supports work-life-oriented educational planning and development, helping vocational institutions respond more effectively to future changes in the labor market.";0;NO_INDICATION_OF_COLLABORATION;Tulevaisuusmuotoilu : osaamisen ennakointi ammatillisessa koulutuksessa;Lab UAS;Hasila, Sami;0;https://www.theseus.fi/handle/10024/893322;"[""No Nokia mention""]"
99;"Matkalla menestykseen: muistiinmerkint—jð Lahden ammattikorkeakoulusta 1991-2020 Ammattikorkeakoulutusta Lahden alueella vuosina 1991-2020

Kðdessðsi olevassa kirjassa muistellaan Lahden ammattikorkeakoulun tarinaa sen henkil—kunnan ja opiskelijoiden nðk—kulmasta. Kirjassa muistelevat opiskelijat, opettajat ja muu henkil—kunta omien t—idensð kautta ammattikorkeakoulun kehitystð ja arkista ty—tð ammattikorkeakoulussa Lahdessa ja lðhiympðrist—ssð. Lisðksi muistelijoina on Lahden ammattikorkeakoulun yhteisty—kumppaneita. Lahden ammattikorkeakoululla oli koulutusta alkuvuosina Lahden lisðksi Heinolassa ja Nastolassa, kunnes koulutus keskitettiin 2000-luvulla yksinomaan Lahteen.

Alkuvuosikymmeninð koulutuksen jðrjestðjðnð ja yllðpitðjðnð oli Pðijðt-Hðmeen koulutuskonserni -kuntayhtymð ja 2010-luvun puolivðlissð ammattikorkeakoululain uudistuksessa koulutuksen yllðpidosta ja jðrjestðmisestð vastasi osakeyhti—, Lahden ammattikorkeakoulu Oy. Vuoden 2018 uudeksi yllðpitðjðksi ja jðrjestðjðksi vaihtui LUT-konserni Lappeenrannasta. Vuoden 2020 alussa Lahden ammattikorkeakoulun tarina itsenðisenð ammattikorkeakouluna pððttyi, kun LUT-konserniin kuuluvat Lahden ammattikorkeakoulu ja Saimaan ammattikorkeakoulu yhdistyivðt ja alkoi uuden LAB-ammattikorkeakoulun toiminta.

Lahden ammattikorkeakoulu jði historiaan.";0;NO_INDICATION_OF_COLLABORATION;Matkalla menestykseen: muistiinmerkint—jð Lahden ammattikorkeakoulusta 1991-2020;Lab UAS;Unknown Author;0;https://www.theseus.fi/handle/10024/887007;"[""No Nokia mention""]"
100;"5G-tukiaseman suuntakuvion mittaaminen dronella Opinnðytety— on osa AGRARSENSE-hanketta, jossa kehitetððn teknologisia ratkaisuja maa- ja metsðtalouteen erityisesti 5G-teknologian hy—dyntðmiseksi. Ty—ssð pyrittiin tutkimaan 5G-signaalin mittaamista droneilla kðytðnn—n kenttð-olosuhteissa ja arvioimaan mittauslaitteiden luotettavuutta. Mittaukset suoritettiin maastossa, jossa saatiin riittðvð katve puustosta mittaustarpeisiin.

Tutkimusmenetelmðksi valittiin empiirinen kenttðmittaus, jossa mittauslaitteena kðytettiin Milesight UF31 5G-donglea. Mittaukset toteutettiin useista etðisyyksistð 5G-tukiasemasta, ja tuloksia verrattiin syksyllð 2024 Ruotsissa Vindelnissð matkapuhelimella tehtyihin mittauksiin. Alun perin ei ollut tarkoituksena vertailla tuloksia, mutta havaittiin, ettð 5G-dongle ei antanut yhtð hyvið tuloksia kuin matkapuhelimella tehdyt mittaukset. Ruotsin mittauksissa matkapuhelimen signaalin voimakkuus oli huomattavasti parempi pidemmillð etðisyyksillð kuin donglella tehdyissð mittauksissa.

Opinnðytety—n tuloksista kðvi ilmi, ettð Milesight UF31 5G-dongle ei ollut riittðvðn tarkka maastossa tehtðviin mittauksiin verrattuna matkapuhelimella saatuihin tuloksiin. Tðmð nosti esiin tarpeen tarkastella luotettavampia mittauslaitteita ja kehittðð vakaampia kiinnitysjðrjestelmið droneilla tehtðviin mittauksiin.

Ty—n tulosten perusteella voidaan tarjota arvokasta tietoa tulevia tutkimuksia ja kðytðnn—n sovelluksia varten erityisesti maa- ja metsðtalouden kentðllð, jossa 5G-teknologia voi tukea kestðvðð kehitystð ja ilmastonmuutoksen haasteisiin vastaamista. Jatkossa olisi suositeltavaa testata luotettavampia 5G-dongleja sekð kehittðð dronejen mittausjðrjestelmið vakaammiksi ja tarkemmiksi.";0;NO_INDICATION_OF_COLLABORATION;5G-tukiaseman suuntakuvion mittaaminen dronella;Lapin UAS;Hagberg, Jarno;0;https://www.theseus.fi/handle/10024/886338;"[""No Nokia mention""]"
101;"5G-kðsikirja Opinnðytety—n aiheena on 5G-jðrjestelmðn kðsikirja Lapin ammattikorkeakoululle. Ty—n tavoitteena on tuottaa selkeð ja kðytðnn—nlðheinen dokumentti, joka tukee jðrjestelmðvalvojien, laboratoriohenkil—kunnan ja opiskelijoiden ty—skentelyð 5G-jðrjestelmðn kanssa omissa projekteissaan. Tarkoituksena on kuvata jðrjestelmðn toimintaa, yllðpitoa ja kðytt——nottoa sekð tarjota ohjeistus mahdollisiin vikatilanteisiin. 

Opinnðytety—n alussa on kðyty lðpi yksityisen operaattorin Lapin ammattikorkeakoulun kiinteðð 5G-jðrjestelmðð ja Off-Grid 5G Mobile Network -jðrjestelmðð arkkitehtuurin, liityntðrajapintojen sekð yllðpidollisista nðk—kulmista. Ty—n alussa on huomioitu eroavaisuudet kaupallisten operaattorien ja Lapin ammattikorkeakoulun 5G-verkon vðlillð sekð yleisesti 5G-verkosta sen teknisistð ominaisuuksista.

Ty—ssð on kðyty lðpi erilaisia teknisið kðsikirjoja sekð standardeja lðpi, miten luoda yhtenevðt kðytðnteet ja yhdenmukaiset rakenteet kðsikirjoille. Ty—ssð kðytettiin lðhteinð julkista aineistoa, kuten kirjallisuutta, muita kðsikirjoja sekð internetistð l—ytyvðð aineistoa parantamaan kðsikirjan systemaattista ja teknistð dokumentointia ammattimaisille kohderyhmille.

Opinnðytety—n tuloksena luotu kðsikirja on merkittðvð tuotos Lapin ammattikorkeakoulun 5G-jðrjestelmðn osalta. Aiempaa versiota 5G-jðrjestelmðn kðytt——n liittyvistð yhdenmukaisista toimintatavoista jðrjestelmðnyllðpitðjille ja laboratoriohenkil—st—lle sekð turvallisesta ty—skentelystð ei ole ollut. Haasteena sekð parannuskohteena kðsikirjalle ovat 5G-jðrjestelmðn laajuus ja kehittyminen.";0;NO_INDICATION_OF_COLLABORATION;5G-kðsikirja;Lapin UAS;Suutari-Jððsk—, Eeli;0;https://www.theseus.fi/handle/10024/889951;"[""No Nokia mention""]"
102;"Emðtilaperiaate ja mitoituksen lðht—kohdat Naantalin kaupungissa Tðmðn opinnðytety—n tarkoituksena oli selvittðð kuntien erilaisia kaavoitusta tukevia mitoitusperiaatteita. Mitoitusperiaatteiden taustalla on monia huomioitavia seikkoja, eikð niitð ohjaavaa lainsððdðnt—ð juurikaan ole. Usein mitoitus perustuu vuosien saatossa kðyt—ssð muovautuneisiin kðytðnteisiin. Yksi yleisimmistð kðytðnteistð on niin sanottu emðtilaperiaate, jossa tarkastellaan kiinteist—jð, emðtiloja, poikkileikkausajankohtaan verraten, jolloin saadaan mððriteltyð mitoitus rakentamista varten. 

Ty—ssðni esittelen esimerkkien kautta erilaisia kðytðnt—jð. Naantalin kaupungin esimerkkeinð on yksi osayleiskaava ja yksi ranta-asemakaava. Ranta-asemakaavojen mitoitus perustuu osayleiskaavojen mitoituksiin ja emðtilaperiaatteeseen, jonka tavoitteena on taata maanomistajien tasapuolinen kohtelu.

Ty—ni perustuu maankðytt—- ja rakennuslakiin, jonka korvaa uudet rakennuslaki ja alueidenkðytt—laki 1.1.2025 alkaen. Uusi alueidenkðytt—laki ei tulle tuomaan kuitenkaan mainittavia muutoksia emðtilatarkastelun perusteeksi. 

Opinnðytety— toteutettiin Naantalin kaupungille ja sen tarkoitus oli tarkastella kaupungin yleiskaavoitusta, eri alueiden erilaisia mitoitusnormeja ja tulevaisuuden mahdollisuuksia Tiera City kaupunkina. Lisðksi pohdittiin yhdenvertaisuuden toteutumisen haastetta.";0;NO_INDICATION_OF_COLLABORATION;Emðtilaperiaate ja mitoituksen lðht—kohdat Naantalin kaupungissa;Lapin UAS;Paassilta, Minna;0;https://www.theseus.fi/handle/10024/878799;"[""No Nokia mention""]"
103;"Kaupunkimallin selvitys organisaatioon Tðmðn opinnðytety—n aihe lðhti tarpeesta selvittðð 3D-kaupunkimallin hy—tyjð ja mahdollisuuksia Sipoon kunnan organisaatioon. Tarkoituksena oli kertoa 3D-kaupunkimallista, miten se soveltuisi organisaatioon ja mitð sen hankinta vaatisi.

Opinnðytety—ssð tutkittiin 3D-kaupunkimallin perusteet, kaupunkimallin hy—dyntðmistð eri tarkoituksiin, kaupunkimallin toteutuksia pððkaupunkiseudulla ja Pirkanmaalla. Lisðksi suoritettiin organisaation sisðllð kysely kaupunkimallista.

Ty—n johtopððt—ksinð saatiin tietoa organisaation yhdyskunnan ja ympðrist—n toimialan hy—dyistð, haasteista ja tarpeista 3D-kaupunkimallinnuksen kðytt——n. Tuloksia pystytððn hy—dyntðmððn 3D-kaupunkimallin hankintaan Sipoon kuntaorganisaatioon.";0;NO_INDICATION_OF_COLLABORATION;Kaupunkimallin selvitys organisaatioon;Lapin UAS;Raassina, Aapo;0;https://www.theseus.fi/handle/10024/893076;"[""No Nokia mention""]"
104;The Perceived Complexity of Well-Being Within the Change and Development in Higher Education In Finland, the higher education system is facing many societal, demographic, and pedagogical changes that inevitably also have an impact on various members of the university community who face them in their everyday work and studies at the universities. This research focused on a systemic and interdisciplinary approach and analyzed the elements of well-being during the changes that occurred in the university consortium. The consortium, formed by a scientific university and a university of applied sciences, is considered here as an example of the changing world of work in higher education (HE). The research question set for this research was: How do the members of the consortium perceive well-being in the systemic development? This paper reports on our phenomenographic research in which 29 members of a northern Finnish university consortium were interviewed with the focus group interview method. The findings showed that their perceptions were related to experiences, interaction, and competence within the development work, and covered various dimensions of the consortium, ranging all the way from the individual level to the surrounding society. Viewed using the framework for a positive university, suggestions for leading well-being within the development of higher education are presented. The findings are also discussed in the light of international scalability.;0;NO_INDICATION_OF_COLLABORATION;The Perceived Complexity of Well-Being Within the Change and Development in Higher Education;Lapin UAS;"Uusiautti, Satu; Vuojðrvi, Hanna; Pruikkonen, Anu; Soukka, Aleksi";0;https://www.theseus.fi/handle/10024/896877;"[""No Nokia mention""]"
105;"Kasvun ja kehityksen tukeminen varhaiskasvatusiðssð psykofyysistð fysioterapiaa ja luontoympðrist—ð hy—dyntðen: toimintakortit varhaiskasvatuksen henkil—kunnalle This thesis focuses on supporting children's motor development and emotional growth through functional and nature-based methods. The aim of the thesis was to respond to the needs of early childhood education staff by providing concrete tools to simultaneously support children's emotional skills, motor abilities, and connection to nature.

The purpose of this study was to develop a practical and user-friendly tool for early childhood education that could holistically promote children's motor development and emotional well-being. Another goal was to contribute to the awareness among early childhood education professionals about children's motor development and age-appropriate motor skills, emotional development and how to support it, as well as the effects of nature on children and how nature can be utilized in early childhood education. These themes formed the theoretical framework of this thesis.

This is a functional thesis consisting of a written report and a set of activity cards produced as the final outcome. The content of the activity cards utilizes nature as a learning environment and supports children's movement and emotional processing. Based on existing research nature and movement-oriented methods that emphasize children's participation support holistic child development and promote well-being in everyday early childhood education.

The commissioner of this thesis was the municipality of Ranua. The municipality intends to utilize the thesis and the activity cards created in their early childhood education practices.";0;NO_INDICATION_OF_COLLABORATION;Kasvun ja kehityksen tukeminen varhaiskasvatusiðssð psykofyysistð fysioterapiaa ja luontoympðrist—ð hy—dyntðen: toimintakortit varhaiskasvatuksen henkil—kunnalle;Lapin UAS;Kokko, Janna;0;https://www.theseus.fi/handle/10024/897895;"[""No Nokia mention""]"
