id;text;target;label;title;university;author;nokia_score;link;nokia_reasons
327;"Suunnattu maksuton osakeanti: erityisen painavan taloudellisen syyn arviointi yhti—n edun valossa Tutkielman tarkoituksena on tarkastella suunnatun maksuttoman osakeannin aineellisena edellytyksenð olevan erityisen painavan taloudellisen syyn merkitystð ja arviointia. Tutkielmassa selvitetððn, mitð erityisen painavalla taloudellisella syyllð tarkoitetaan osakeyhti—oikeudessa, sillð lainsððdðnt— ei anna kðsitteelle tðsmðllistð mððritelmðð. Syyn painavuutta tarkastellaan suhteessa suunnatun osakeannin aineelliseen edellytykseen eli painavaan taloudelliseen syyhyn sekð osakeyhti—laissa vahvistettuihin yleisiin periaatteisiin.

Aineellisen edellytyksen ohella tutkielmassa analysoidaan suunnattuja osakeanteja koskevaa pððt—ksentekoa yhti—n johdon fidusiaaristen velvollisuuksien nðk—kulmasta. Tarkoituksena on arvioida, millð perusteilla yhti—n johto voi katsoa painavan tai erityisen painavan taloudellisen syyn tðyttyneen ja miten tðtð koskevista perusteluista tulisi tiedottaa osakkeenomistajille hyvðn arvopaperimarkkinatavan mukaisesti. Oikeuskirjallisuuden, Fortum Oyj:n ja Nokia Oyj:n tapausesimerkkien sekð korkeimman oikeuden ratkaisun KKO 2018:19 perusteella esitðn tulkintaohjeistuksen painavan ja erityisen painavan taloudellisen syyn arvioinnista yhti—n edun ja yhti—n johdon fidusiaaristen velvollisuuksien valossa.

Johtopððt—ksenð esitðn, ettð syyn painavuus on luonteeltaan dynaaminen kðsite. Osakeannin suuntaaminen edellyttðð aina  sen toteutustavasta ja tarkoituksesta riippumatta  yhti—n edun mukaista ja hyvðksyttðvðsti perusteltua syytð. Erityisen painavan taloudellisen syyn arviointi on kaksivaiheinen: ensinnðkin on tunnistettava suuntaamisen perusteena oleva tyyppitapaus tai muu kðytt—tarkoitus, ja toiseksi on osoitettava, ettei tavoiteltua lopputulosta ole mahdollista saavuttaa osakkeenomistajien taloudellista yhdenvertaisuutta vðhemmðn loukkaavin keinoin.";1;NOKIA_COLLABORATION;Suunnattu maksuton osakeanti: erityisen painavan taloudellisen syyn arviointi yhti—n edun valossa;University of Helsinki;Vanninen, Elias;9;https://helda.helsinki.fi/handle/10138/626764;"[""Nokia mentioned"",""Specific Nokia entity detected (1)""]"
328;"Aloitteesta pððt—kseen : Suomen evankelis-luterilaisen kirkon ilmasto-ohjelman alkuvaiheet kirkolliskokouksessa 2007 Tutkielmassa tarkastellaan kirkolliskokouksen kðsittelyð Suomen evankelis-luterilaisen kirkon ilmastoohjelmaa koskevasta edustaja-aloitteesta vuoden 2007 kevððn istuntokaudella. Aloitteesta seurasi lðhetekeskustelu, jossa neuvoteltiin ohjelman sisðll—stð. Tðmðn jðlkeen asiasta oli mietint—, jonka jðlkeen kirkolliskokous pððtti lðhettðð asian eteenpðin kirkkohallitukselle jatkotoimenpiteitð varten. Tutkielmani tavoitteena on osoittaa kirkolliskokouksen kðymðn eettisen keskustelun olevan tðrkeð esimerkki kirkon sisðisestð ilmastoty—stð.

Tutkielman ensimmðinen luku toimii johdantona tutkielman aiheeseen. Toisessa luvussa annetaan taustaa kirkon ilmastokeskustelusta 2000-luvun alussa, kerrotaan tutkimuskysymys sekð kðytettðvð kirjallisuus ja lðhteet. Kolmas luku on tutkielman pððluku, ja siinð tarkastellaan ilmasto-ohjelman edustaja-aloite, edustajien lðhetekeskustelu, tðstð seurannut mietint— ja lopulta kirkolliskokouksen pððt—s. Tutkin prosessia kirkolliskokousten arkistojen kautta ja nostan esiin edustajien kommentteja hahmottaakseni yleistð aateilmapiirið. Johtopððt—kseni esittelen tutkielman neljðnnessð luvussa, ja viidenteen lukuun olen merkinnyt kðyttðmðni lðhteet sekð kirjallisuuden.

Aineiston perusteella tutkielmassa esitetððn, ettð kirkolliskokouksen kðsittely edustaja-aloitteesta 1/2007 oli hyvin omistautunutta ja kaikki edustajat pððsivðt osallistumaan siihen tasapuolisesti. Edustajiin kuului taustoiltaan monipuolinen joukko sekð kirkon ty—ntekij—itð, pappeja, teologeja ja muiden alan asiantuntijoita. Vaikka erimielisyyksið syntyikin teologiasta ja kðytðnn—n toteutuksesta, kirkolliskokous pððsi lopussa yhteisymmðrrykseen edustajien tunnustaessa asian tðrkeyden. Kirkolliskokouksen kðsittely nðyttðytyy merkittðvðnð ilmastoty—nð ja on esimerkki kirkon vaikutusvallasta yhteisissð arvokeskusteluissa.";0;NO_INDICATION_OF_COLLABORATION;Aloitteesta pððt—kseen : Suomen evankelis-luterilaisen kirkon ilmasto-ohjelman alkuvaiheet kirkolliskokouksessa 2007;University of Helsinki;Salminen, Juuso Aapeli;0;https://helda.helsinki.fi/handle/10138/611340;"[""No Nokia mention""]"
329;"Tapahtumaliikenne osana kaupunkiliikennettð Suurtapahtumien aiheuttama kuorma kaupunkiliikenteelle on merkittðvð. Liikenteen kðyttðjien moninkertaistuminen asettaa kaupunkiliikenteen eri kulkumuodot entistð alttiimmiksi ruuhkautumiselle. Tapahtumaliikenteen rooli suurtapahtumien jðrjestðmisessð on suuri, koska tapahtumapaikkojen saavuttaminen riippuu toimivasta liikennejðrjestelmðstð.

Tðmðn ty—n tavoitteena on tutkia, mitkð asiat vaikuttavat tapahtumaliikenteen ominaisuuksiin sekð jðrjestðmiseen. Ty—n toisena tavoitteena on tarkastella, miten kaupunkiliikenteen eri kulkumuodot otetaan huomioon tapahtumaliikennettð jðrjestettðessð. Tapahtumaliikenteen jðrjestðmiseen tutustutaan my—s Nokia Arena -esimerkin avulla. Ty— on toteutettu kirjallisuustutkielmana, jossa pððasiallisina lðhteinð on kðytetty kansainvðlisið tieteellisið julkaisuja aihepiirin ympðriltð.

Tapahtumaliikenteen luonne koostuu useasta eri tekijðstð. Tapahtumaliikenteen luonteeseen vaikuttavien tekij—iden tunnistaminen on tðrkeð osa liikennejðrjestelyiden suunnittelua sekð toteuttamista. Tapahtumaliikenteeseen vaikuttaa tapahtuman ajankohta, kesto, sijainti, tyyppi, markkinointialue, alueen tyyppi, odotettu osallistujamððrð sekð yleis—n huomiointi. Tapahtumaliikenteen suunnittelua voidaan tehdð esimerkiksi aiempien vastaavanlaisten esimerkkien pohjalta.

Tapahtumaliikenteen jðrjestðmistð tutkitaan tðssð ty—ssð henkil—autoilun, aktiivisten kulkumuotojen (py—rðily ja kðvely) sekð joukkoliikenteen nðk—kulmasta. Henkil—autoliikenteen hallinta koostuu erilaisista strategioista, joihin kuuluu tiedottaminen, liikenteenohjauslaitteet, reittien optimointi, pysðk—intisuunnitelma sekð liikenteen kysynnðn hallinta. Aktiivisten kulkumuotojen jðrjestðmistð edistetððn infrastruktuurin parannusten sekð mainonnan avulla. Joukkoliikenteen kðytt—ð voidaan taas tehostaa tapahtuman aikaisten jðrjestelyiden, onnistuneiden kðyttðjðkokemusten sekð tapahtuman jðrjestðjien ja joukkoliikenteen tarjoajien yhteisty—llð.

Ty—ssð perehdytððn my—s Tampereella sijaitsevan Nokia Arenan tapahtumaliikenteen jðrjestelyihin. Areena on sijaintinsa puolesta erittðin hyvin saavutettavissa niin kestðvin kulkumuodoin kuin henkil—autolla. Areenan lðheisyydessð sijaitsee joukkoliikennepysðkkejð sekð pysðk—intitilaa autoille ja muille kulkumuodoille. Liikennejðrjestelyt vaihtelevat areenalla jðrjestettðvien tapahtumien mukaan. Areenalla jðrjestettðvðt tapahtumat jakautuvat liikennejðrjestelyiden nðk—kulmasta konsertteihin (15 000 katsojaa) sekð urheilutapahtumiin (5 2008 000 katsojaa).

Tulevaisuuden tutkimuskohteiksi ty—ssð tunnistettiin tapahtumaliikenteen ympðrist—vaikutukset. My—s ty—ssð tðrkeðnð pidetyt nðk—kulmat turvallisuus sekð sujuvuus voitaisiin valita yksityiskohtaisempaan tarkasteluun. Kaupunkiliikenteen kulkumuodoista sðhk—potkulautojen rooli tapahtumaliikenteessð olisi my—s ajankohtainen aihe tulevaisuuden tutkimuksille.";0;NO_INDICATION_OF_COLLABORATION;Tapahtumaliikenne osana kaupunkiliikennettð;Tampere University;Haikonen, Onni;1;https://trepo.tuni.fi/handle/10024/228699;"[""Nokia mentioned""]"
330;"Network element credential verification in MantaRay NM Computer networks are a central part of critical infrastructure in modern society. At their current scale, networks have become so complex and extensive that, without standardized network management functions and systems, maintaining their operation and reliability would be extremely challenging. This thesis explores network management (NM), with a particular focus on Nokia's Network management system (NMS), MantaRay NM. The goal of this work is to develop a test automation program for MantaRay NM, which will verify the correctness of the credentials entered for network elements within the management system.

The thesis is divided into two parts. The first part involves a literature review on network management and the MantaRay NM system. This review also includes an examination of MantaRay NM's internal application, Network Element Access Control (NEAC), and the network protocols it uses, which are essential for implementing the test automation program. The literature review revealed that network management is guided by standards such as ITU-T X.700: Management Framework for Open Systems Interconnection (OSI) for CCITT applications. This standard defines five key network management functions, which can be implemented using various protocols, such as the Simple Network Management Protocol (SNMP). These network management functions are utilized in network management systems to monitor and maintain various network elements, such as 4G and 5G base stations and the networks they form.

The second part of the thesis focuses on the development of the test automation program using the Python programming language. The purpose of this program is to retrieve the credentials entered into NEAC for different protocols and test their functionality on the network elements. The program identifies which protocols have been assigned to a selected network element in NEAC and indicates which protocols passed the tests and which did not. This information is valuable for troubleshooting during the integration of network elements.

The result of this work is a functional test automation program that, in addition to protocol-specific test functions, includes features such as logging and error handling. The program effectively identifies potential error-prone points during troubleshooting. Test functions for five of the most used protocols have been implemented, and in the future, the testing capabilities could be expanded to cover a larger number of protocols, further automating the troubleshooting process.";1;NOKIA_COLLABORATION;Network element credential verification in MantaRay NM;Tampere University;Laulainen, August;8;https://trepo.tuni.fi/handle/10024/227217;"[""Nokia mentioned"",""Nokia resource proximity detected""]"
332;"Seudullinen elinkeino- ja kehitysyhti— elinkeinopalveluiden tuottajana: Case Business Tampere Tðmð tutkimus kðsittelee yritys- ja elinkeinotoiminnalle suunnattujen palveluiden tuottamista kunnissa seudullisten elinkeinoyhti—iden kautta. Business Tampere valikoitui tutkimuksen kohteeksi, sillð Tampereen seutu eli Business Tampereen omistajakunnat omaavat yhdessð monipuolisen elinkeinorakenteen sekð on yksi Suomen suurimmista talousalueista ja kasvukeskuksista. Omistajakuntia ovat Tampere, Lempððlð, Nokia, Pirkkala, Orivesi, Vesilahti, Yl—jðrvi sekð Kangasala. Business Tampere kyseisen seudun kehitys- ja elinkeinoyhti—nð toimii elinkeinopolitiikan ytimessð. Tutkimuksen tarkoituksena on kuvailla ja analysoida Business Tampere Oy:n tuottamia palveluita sen omistajakunnille Tampereen seudulla.
Ty—n teoreettinen viitekehys koostuu kirjallisuudesta, joka kðsittelee kuntastrategiaa, kunnallista elinkeinopolitiikkaa, seutuistumista ja seutuyhteisty—tð sekð seudullisen elinkeinoyhti—n roolia kunnan elinkeinopolitiikan toteuttajana. Viitekehys muodostaa kokonaisuuden, jossa edetððn kunnan strategiatasolta elinkeinopolitiikan kðytðnn—n toteutukseen. 
Tutkimuksen aineistona on Business Tampereen palvelusopimusehdotukset kunnille vuosilta 20202024. Tutkimuksessa aineistosta kðytetððn nimitystð palvelusopimusehdotus, sillð nðmð ovat Business Tampereen laatimia kokonaisuuksia, joissa esitetððn kunnille kulloisenkin vuoden kokonaisuudet hankkeiden ja toimenpiteiden osalta, mutta niitð ei ole vielð allekirjoitettu sopimusmuotoon.
Tutkimus on toteutettu kvalitatiivisena eli laadullisena tapaustutkimuksena. Tutkimuksessa kohdeorganisaation kautta pyritððn havainnollistamaan sitð, millainen rooli elinkeinoyhti—llð on seudullisen elinkeinopolitiikan kðytðnn—ntoteuttajan roolissa. Tutkimuksessa hy—dynnetððn aineistolðht—istð sisðll—nanalyysið, jossa analyysi etenee aineiston ehdoilla. Tutkimusaineiston analyysin kautta on tunnistettavissa viisi keskeistð palvelu- ja toimenpidekokonaisuutta: kaupunkiseudun tunnettuus, alueen saavutettavuus, kasvuyritysten tukeminen, startup-yritysten ja alkavien yrittðjien kasvun kehittðminen sekð kestðvð kehitys. 
Tutkimuksen johtopððt—ksinð voidaan todeta, ettð Business Tampere vastaa kehitysyhti—lle mððriteltyihin pððtehtðviin, joita ovat yrityskehittðminen, toimintaympðrist—n kehittðminen sekð alueen markkinointi. Lisðksi tuloksista voidaan tehdð havainto Business Tampereen omistajakunnilleen osoittamien palveluiden ja toimenpiteiden laajuudesta sekð monipuolisuudesta. Toimenpiteiden kohteena on monialaisesti eri vaiheissa ja erilaisia tarpeita vaativat yritykset ja elinkeinotoiminnan harjoittajat. Aineistosta on my—s havaittavissa Business Tampereen palveluiden ja toimenpiteiden joustavuus erillistilausten muodossa. Palvelusopimusten liitteenð toteutettavat erillistilaukset ovat kuntakohtaisia ja niiden kautta voidaan huomioida kuntien erityisintressit.";0;NO_INDICATION_OF_COLLABORATION;Seudullinen elinkeino- ja kehitysyhti— elinkeinopalveluiden tuottajana: Case Business Tampere;Tampere University;Nieminen, Mimosa;1;https://trepo.tuni.fi/handle/10024/228217;"[""Nokia mentioned""]"
334;The Role of Public-Private Partnerships in fostering Circular Economy Practices: A Case Study of Lounapuisto Circular Economy Park The research topic of this study is public-private partnerships (PPPs) role in fostering circular economy practices. The case study is Lounapuisto circular economy park in Salo, Southwest Finland. The purpose of this study is to research the roles in the interplay of the public and private sectors, the partnership value of the collaboration and the role the partnership has in driving forward circular economy initiatives. Therefore, the study aims to answer the research question of how public-private partnerships are useful in aiding circular economy, through the lens of industrial ecology and administrative sciences. The research uses a qualitative analysis method, because the meaning of the study is to form a deeper understanding of the dynamics in the public-private partnership interplay, as well as of the opportunities it offers to support circular economy practices. The theoretical framework is used in forming the interview questions, which were formed together with Jarmo Uusikartano. The empirical research includes the two semi-structured interviews conducted from the stakeholders and circular economy experts of the Lounapuisto project, which were then structured using the thematic analysis method. Conclusions were drawn to the roles of both sectors in the partnership, partnership value, challenges, and dialogue mechanisms for circular economy. Differences between the sectors were identified, consisting of the roles in the project as well as the challenges that arose. The literature in the theoretical background supports the findings of the content analysis. The research gives insights into the fields of administrative sciences, industrial ecology, and sustainable urban development.;0;NO_INDICATION_OF_COLLABORATION;The Role of Public-Private Partnerships in fostering Circular Economy Practices: A Case Study of Lounapuisto Circular Economy Park;Tampere University;Paju, Minni;0;https://trepo.tuni.fi/handle/10024/228375;"[""No Nokia mention""]"
336;"Tanssin talo Kaapelitehtaan laajennuksena : muutoskestðvyys fenomenologian nðk—kulmasta Helsingin Kaapelitehtaalla sijaitseva Tanssin talo edustaa uuden suomalaisen arkkitehtuurin keihððnkðrkeð. Se on ensimmðinen aidosti tanssitaidetta varten rakennettu esiintymistila, ja rakennus valittiin arkkitehtuurin Finlandia -ehdokkaaksi vuonna 2023. Tanssin talo ei kuitenkaan edusta kokonaisvaltaisesti uutta arkkitehtuuria, vaan se nojaa vahvasti Kaapelitehtaan teolliseen historiaan.

Tðssð ty—ssð Tanssin taloa tarkastellaan fenomenologian silmin. Fenomenologia on filosofian ala, joka tutkii ihmisen subjektiivisia aistihavaintoja ja kokemuksia. Arkkitehtuurin ja fenomenologian vðlistð yhteyttð on pohdittu paljon, ja aiheesta ovat kirjoittaneet esimerkiksi arkkitehdit Peter Zumthor ja Juhani Pallasmaa. Tutkielman fenomenologisen tarkastelun tavoitteena on muodostaa kuva Tanssin talon muutoskestðvyydestð. Arkkitehtuurin muutoskestðvyys on olennainen osa ilmastokriisin vastaisessa ty—ssð. Muutoskestðvyydellð pyritððn kestðvððn, muutokseen sopeutuvaan arkkitehtuuriin, joka mahdollistaa pitkðn kðytt—iðn ja vðhentðð purkamisen tarvetta.

Ty—ssð nðmð kolme aihetta yhdistyvðt uudella tavalla. Muutoskestðvyyttð tutkitaan fenomenologisesta nðk—kulmasta, ja Tanssin talo toimii analyysille nðyttðm—nð. Tutkimusaineistona on kðytetty havaintokertomusta, joka kerðttiin tutustumalla Tanssin taloon. Vierailu keskittyi moniaistilliseen, fenomenologiseen havainnointiin rakennuksesta. Sen pohjalta kirjoitettua tekstið analysoidaan ty—ssð eri muutoskestðvyyden strategioiden kautta. Strategioita on pyritty sitomaan fenomenologiaan my—s tunnettujen arkkitehtifenomenologien tekstien avulla.

Lopputuloksena voidaan todeta, ettð Tanssin talo on fenomenologisesti tarkasteltuna muutoskestðvð rakennus. Se toteuttaa muutoskestðvyyttð laadukkailla arkkitehtonisilla valinnoilla, jotka tukevat muutoskestðvið strategioita. Lisðksi on havaittavissa, ettð fenomenologia ja muutoskestðvyys on mahdollista yhdistðð toisiinsa niin, ettð molempiin avautuu uusia nðk—kulmia. Fenomenologista analyysia voidaan kðyttðð muutoskestðvðn suunnittelun ty—kaluna. Kððnteisesti muutoskestðvððn rakentamiseen pyrkiminen tarjoaa uusia kðytt—mahdollisuuksia fenomenologiaan pohjautuvalle arkkitehtuurin teorialle.";0;NO_INDICATION_OF_COLLABORATION;Tanssin talo Kaapelitehtaan laajennuksena : muutoskestðvyys fenomenologian nðk—kulmasta;Tampere University;Kaimio, Arttu;0;https://trepo.tuni.fi/handle/10024/226397;"[""No Nokia mention""]"
337;"Omien osakkeiden takaisinostoilmoitusten vaikutus osakekursseihin Tðssð tutkielmassa tutkitaan omien osakkeiden takaisinostoilmoitusten yhteydessð esiintyvið epðnormaaleja tuottoja. Omien osakkeiden takaisinostoilmoitus tarkoittaa yhti—n julkaisemaa p—rssitiedotetta, jossa se ilmoittaa aloittavansa omien osakkeiden takaisinosto-ohjelman. Suomessa aihetta on tutkittu vain niukasti, eikð tuoreella aineistolla toteutettuja tutkimuksia ole. Tðmðn tutkielman tarkoituksena onkin tuoda pðivitettyð tietoa Helsingin p—rssissð julkaistujen takaisinostoilmoitusten yhteydessð esiintyvistð epðnormaaleista tuotoista. 

Tutkielman aineisto kðsitðð Helsingin p—rssin yhti—iden vuosina 20222024 julkaisemat takaisinostoilmoitukset. Lopullinen aineisto koostuu 80 takaisinostoilmoituksesta. Tutkielman tutkimusmenetelmðnð kðytettiin tapahtumatutkimusta, jonka avulla voidaan tutkia takaisinostoilmoitusten yhteydessð esiintyvið epðnormaaleja tuottoja. Tutkielmassa epðnormaaleja tuottoja tarkasteltiin yhteensð 11 pðivðn mittaisella tapahtumaikkunalla. 

Tulokset osoittivat, ettð tilastollisesti merkitsevið epðnormaaleja tuottoja esiintyy ainoastaan takaisinostoilmoitusten julkaisupðivðnð eli tapahtumapðivðnð. Tapahtumapðivðnð havaittu 0,89 % keskimððrðinen epðnormaali tuotto kertoo, ettð takaisinostoilmoitukset nðhdððn markkinoilla positiivisena uutisena. Tapahtumapðivðð edeltðvien pðivien kumulatiiviset keskimððrðiset epðnormaalit tuotot olivat positiiviset, mutta tulos ei ollut tilastollisesti merkitsevð. Positiivinen tulos kuitenkin viittaa siihen, ettð Helsingin p—rssin yhti—t eivðt keskimððrin kðyttðneet takaisinostoilmoituksia signaloimaan osakkeen alihinnoittelua. My—s tapahtumapðivðn jðlkeisten pðivien kumulatiiviset epðnormaalit tuotot olivat positiiviset, mutta tilastollisesti merkitsemðtt—mðt. Tilastollisen merkitsevyyden puuttuessa voidaan pððtellð, ettð Helsingin p—rssin osalta sijoittajat hinnoittelevat takaisinostoilmoitusten tuoman uuden informaation tehokkaasti, eivðtkð he vðhðttele uutta informaatiota tapahtumapðivðnð.";0;NO_INDICATION_OF_COLLABORATION;Omien osakkeiden takaisinostoilmoitusten vaikutus osakekursseihin;Tampere University;Lesell, Miro;0;https://trepo.tuni.fi/handle/10024/226234;"[""No Nokia mention""]"
338;"IoT-teknologia miehittðmðtt—mien ilma-alusten riskienhallintakeinona Miehittðmðtt—mien ilma-alusten (UAV) mððrðn nopea kasvu on tuonut mukanaan uusia turvallisuusuhkia ja haasteita, joihin perinteiset riskienhallintamenetelmðt eivðt yksinððn vðlttðmðttð riitð. Tðmðn kandidaatintutkielman tavoitteena on selvittðð, miten esineiden internet (IoT) -teknologiaa voidaan hy—dyntðð miehittðmðtt—mien ilma-alusten riskienhallinnassa. Tutkielma tarkastelee aihetta ISO 31000 -riskienhallintastandardin prosessimallin kautta.

Tutkimus toteutettiin laadullisena dokumenttianalyysina. Tutkimusaineisto koostui kahdeksasta vuosina 20202025 julkaistusta ilmailuviranomaisten, laitevalmistajien ja standardijðrjest—jen dokumenteista, jotka valittiin harkinnanvaraisella otannalla. Aineisto analysoitiin teorialðht—isellð sisðll—nanalyysillð, jossa ISO 31000 -standardin vaiheet (riskin tunnistaminen, analysointi, kðsittely sekð seuranta) toimivat analyysirungon ylðluokkina.

Tutkimuksen tulokset osoittavat, ettð IoT-teknologia tehostaa merkittðvðsti riskienhallintaprosessin kaikkia operatiivisia vaiheita. Riskien tunnistamisessa IoT-sensorit ja verkottuneet jðrjestelmðt laajentavat havaintokykyð inhimillisten aistien ulkopuolelle ja mahdollistavat esimerkiksi teknisten vikojen ja yhteisty—haluttomien ilma-alusten havaitsemisen. Riskien analysoinnissa ja arvioinnissa tekoðly ja koneoppiminen nopeuttavat pððt—ksentekoa ja mahdollistavat reaaliaikaisen riskilaskennan. Riskien kðsittelyssð IoT mahdollistaa automaattiset vastatoimet, kuten itsenðiset vðist—liikkeet (esim. ACAS sXu) ja kyberturvallisuuden parantamisen salauksen avulla. Riskien seurannassa IoT muuttaa valvonnan jatkuvaksi ja dataan perustuvaksi prosessiksi esimerkiksi Network Remote ID -teknologian avulla.

Johtopððt—ksenð todetaan, ettð IoT-teknologia ei toimi vain yksittðisenð apuvðlineenð, vaan se muuttaa miehittðmðtt—mien ilma-alusten riskienhallinnan luonnetta perusteellisesti. Siirtymð on tapahtumassa reaktiivisesta ja ihmiskeskeisestð toiminnasta kohti proaktiivista, automatisoitua ja dataan perustuvaa toimintamallia. Tðmð parantaa lentoturvallisuutta erityisesti vaativissa operaatioissa, kuten nðk—yhteyden ulkopuolella lennettðessð (BVLOS).";0;NO_INDICATION_OF_COLLABORATION;IoT-teknologia miehittðmðtt—mien ilma-alusten riskienhallintakeinona;Tampere University;Niemensivu, Olli;0;https://trepo.tuni.fi/handle/10024/234450;"[""No Nokia mention""]"
