id;text;target;label;title;university;author;nokia_score;link;nokia_reasons
205;"Olet meille tðrkeð  varhaiskasvatustiimin toiminta lapsen varhaisen tuen mahdollistajana Tðmðn opinnðytety—n tarkoituksena oli tarkastella varhaisen tuen toteutumista Kajaanin kunnallisissa varhaiskasvatusyksik—issð ja selvittðð varhaiskasvatustiimien toimintaa lapsen varhaisessa tukemisessa sekð varhaiskasvattajien nðkemyksið varhaisen tuen osaamisestaan. Tavoitteena oli tuottaa toimeksiantajalle uutta, tutkimusperustaista tietoa, jota voidaan hy—dyntðð muun muassa varhaiskasvattajien ammattitaidon ja 
varhaiskasvatustiimien toiminnan kehittðmisessð. Varhaisen tuen tunnistaminen ja sen antaminen ovat keskeisessð osassa laadukasta varhaiskasvatusta. 

Tutkimus toteutettiin laadullisena tutkimuksena, jonka aineisto kerðttiin Kajaanin kaupungin varhaiskasvatuksen varhaiskasvattajille ja varhaiskasvatustiimeille suunnatuilla kyselyillð sekð teemahaastattelulla. Keskeisinð kðsitteinð olivat tiimity—, varhainen tukeminen ja ammatillinen osaaminen. Aineisto kðsiteltiin aineistolðht—isellð sisðll—nanalyysilla. 

Tutkimuksen tulosten mukaan varhainen tukeminen varhaiskasvatuksessa muodostui lapsen systemaattisesta havainnoinnista, sððnn—llisistð pedagogisiin kðytðnteisiin liittyvistð keskusteluista, lapsen tuen tarpeen 
tunnistamisesta, tiimin yhteisestð ja johdonmukaisesta toimintatavasta sekð varhaiskasvattajien ammatillisesta osaamisesta, muun muassa lapsen kehityksen tuntemisesta. Varhaiskasvattajat tunnistivat omaa varhaisen tuen osaamistaan ja roolejaan varhaiskasvatuksen arjessa. Jatkotutkimusaiheina voisi olla sosionomien osaamisen hy—dyntðminen perheiden varhaisessa tukemisessa sekð varhaiskasvatuksen 
kokopðivðpedagogiikka varhaisen tuen vðlineenð. Lisðksi Kajaanissa kðyt—ssð olevaa lapsen tilanteen kartoitus lomaketta, olisi kiinnostavaa tutkia varhaisen ty—n vðlineenð varhaiskasvatuksessa.    

The purpose of this thesis was to examine the implementation of early support in municipal early childhood education units in Kajaani, to explore how early childhood education teams work in supporting children at an early stage, and to investigate educators perceptions of their own competences in providing early support. The aim was to produce new research-based knowledge for the commissioner, which can be utilized in developing the professional skills of early childhood educators as well as the practices of early childhood education teams. Identifying and providing early support are central elements of high-quality early childhood education.

The study was conducted as qualitative research. The data was collected through questionnaires targeted at early childhood educators and teams in the city of Kajaani, as well as through a thematic interview. The key concepts of the study were teamwork, early support, and professional competence. The data was analysed using data-driven content analysis.

The results indicate that early support in early childhood education consists of systematic observation of the child, regular discussions related to pedagogical practices, recognizing the childs need for support, a consistent and collaborative team approach, and the professional expertise of educators, including knowledge of child development. Educators were able to identify their own competences in early support and their roles in the everyday practices of early childhood education. Potential topics for further research include the utilization of social educators expertise in supporting families, the role of full-day pedagogy as a tool for early support, and the use of the childs situation assessment form currently applied in Kajaani as an instrument for early support in early childhood education.";0;NO_INDICATION_OF_COLLABORATION;Olet meille tðrkeð  varhaiskasvatustiimin toiminta lapsen varhaisen tuen mahdollistajana;Savonia UAS;"Kerðnen, Anna; Kurikka, Katja";0;https://www.theseus.fi/handle/10024/898840;"[""No Nokia mention""]"
207;"React-Based Chatbot UI for Generative AI: a reusable and extensible framework for Nokia R&D The explosive development of Artificial Intelligence (AI) has revolutionized human-computer interaction, with intelligent chatbots emerging as a pivotal technology in the digital landscape. In this thesis, a React-based chatbot user interface framework is developed for integration within Nokia's research and development teams. The framework aims to create a reusable and expandable solution for leveraging powerful Large Language Models (LLMs) within Nokia, particularly by addressing internal operational requirements and private data protection. 
The primary objective is to create a chatbot that leverages Large Language Models (LLMs) to give users easy access to Nokia's internal knowledge base in addition to replicating conversational Artificial intelligence capabilities. The framework emphasizes scalability, simplicity of customization, and successful interaction with current Nokia platforms by leveraging React, NodeJS, Express and Docker technologies. This work sets the groundwork for future artificial intelligence-driven products at Nokia by advancing the theoretical understanding of chatbot generation and practical applications in artificial intelligence systems.
By documenting both the architectural decisions and the deployment pipeline, the thesis provides a template that other internal teams may use when developing or scaling secure, AI-driven chat interfaces. This study thus contributes useful insights and a framework for advancing enterprise-grade conversational AI applications.";1;NOKIA_COLLABORATION;React-Based Chatbot UI for Generative AI: a reusable and extensible framework for Nokia R&D;Seinajoen UAS;Ha, Vien;16;https://www.theseus.fi/handle/10024/883547;"[""Nokia mentioned"",""Nokia resource access (1)"",""Author employment or internship at Nokia detected""]"
208;"Developing a business model through marketing research and strategic management models A strategic business model describes how company is operating in respect of customers, partners and competitors in a way that creates profit. Companies that have planned their business thoroughly are more likely to succeed in execution. 

Therefore, this thesis aims to develop a business model for a new service business idea. The theoretical framework introduces information for designing and executing marketing research and presents a selection of strategic management models together with principles of competitive strategies. SWOT, PESTEL and Porters five forces are introduced for business environment scanning. Business model canvas, and itÇs triple layered version, balanced scorecard, strategy map and blue ocean are forming the selection of strategic management models. Also 7P marketing strategy for services is included. The framework also offers an introduction to targeted customer segment as consumers and marketing targets.

For business model development it was designed and executed marketing research that aimed to identify market potential and business opportunities and problems. The marketing research revealed existing market potential and characteristics that are valued in customer evaluation of the service. These findings are used in designing process of the business model.

SWOT analysis and business model canvas has been reflected as strategic tools for business model design in this study. During the process canvas was expanded to triple layered based to the findings in the process. As a result of this process thereÇs a strategic business model designed including business to customers and business to business functions. Sustainability and social responsibility were part of the development process since they are key elements for businesses in future. 

Moreover, as it is a new and innovative business idea, following research and more detailed calculations are suggested. As the possibility of B2B function was found late in the process, it wasnÇt part of the marketing research carried out. Therefore, following framework and marketing research for this function would give valuable insight for the futures development of this business model.";0;NO_INDICATION_OF_COLLABORATION;Developing a business model through marketing research and strategic management models;Seinajoen UAS;Kiviluoma, Veera;0;https://www.theseus.fi/handle/10024/879353;"[""No Nokia mention""]"
209;"Laitetilan olosuhdehðlytykset Tðmð opinnðytety— tehtiin toimeksiantajan tarpeeseen saada jðrjestelmiin niin viranomaisen mððrittelemien teletilojen olosuhdehðlytykset kuin toimeksiantajan tarpeelliseksi kokemia muita olosuhdetietoja. 
Ty—ssð huomattiin, ettð tarpeelliset olosuhdehðlytykset vaihtelevat teletilan koon ja tyypin mukaan. Samalla huomattiin, ettð my—s itse laitetilan olosuhteet ja tarvittava tiedonvðlityslaitteisto vaihtelee laitetilan koon mukaan.
Lopputuloksena toimeksiantajalle toteutettiin priorisoitu hðlytyslaitteiden asennuslistaus ja ohjeistus kyseisten laitteiden fyysiseen asentamiseen.";0;NO_INDICATION_OF_COLLABORATION;Laitetilan olosuhdehðlytykset;Seinajoen UAS;Mikkilð, Teija;0;https://www.theseus.fi/handle/10024/903670;"[""No Nokia mention""]"
210;"Verkkosivujen suunnittelun vaikutus kðyttðjien kðyttðytymiseen ja pððt—ksentekoon Opinnðytety—ssð tutkitaan, kuinka verkkosivuston suunnitteluelementit, kuten vðrimaailma, typografia ja rakenne vaikuttavat kðyttðjien pððt—ksentekoon ja yleiseen kðytt—kokemukseen. Tutkimuksen tarkoituksena oli saada datapohjaista tietoa suunnittelukðytðnn—istð, jotka lisððvðt tehokkuutta ja kðytettðvyyttð.
Tutkimuksessa kðytettiin kvantitatiivista lðhestymistapaa A/B-testauksen muodossa. Testattavana olivat kaksi saman sisðll—n omaavaa verkkosivua, joista verkkosivusto A oli erityisesti suunniteltu opinnðytety—h—n kerðtyn tiedon pohjilta. Osallistujille jaettiin kysely sen jðlkeen, kun he olivat olleet vuorovaikutuksessa verkkosivustojen kanssa ja nðin kerðttiin tietoa heidðn kokemuksistaan. Tutkimusjoukoksi valittiin vapaaehtoiset opinnðytety—n tekijðn sðhk—postilistalta, sillð kyseinen joukko edusti kohdeyleis—ð.
Tulokset osoittivat, ettð tietyt suunnitteluvalinnat vaikuttivat merkittðvðsti kðyttðjien mielipiteisiin. Esimerkiksi selkeð asettelu ja yhtenðinen vðrimaailma korreloivat selvðsti kyselyssð saatujen korkeampien arvosanojen kanssa. Verkkosivusto A ohitti yleensð verkkosivusto B:n kðytettðvyydessð ja miellyttðvyydessð, vaikka molemmat versiot tarjosivatkin arvokasta tietoa kðyttðjien ajatuksista.
Tutkimuksen pohjalta todetaan, ettð datalðht—iset suunnittelupððt—kset, jotka perustuvat testeihin ja kðyttðjien palautteeseen, voivat parantaa kðytt—kokemusta huomattavasti. Kðytðnn—n suosituksia ovat selkeyden priorisointi, temaattisen johdonmukaisuuden sðilyttðminen ja jatkuva sivujen testaus kðyttðjien tarpeiden mukaisesti.";0;NO_INDICATION_OF_COLLABORATION;Verkkosivujen suunnittelun vaikutus kðyttðjien kðyttðytymiseen ja pððt—ksentekoon;Seinajoen UAS;Rannisto, Timi;0;https://www.theseus.fi/handle/10024/879144;"[""No Nokia mention""]"
212;"Simulointimallien rakentaminen robottisoluista Opinnðytety—n tavoitteena oli rakentaa simulointimallit kolmesta toimeksiantajayritys Eino Korhonen Oy:n robottisolusta etðohjelmointitarkoitukseen. Yritys toivoi simulointimallien vðhentðvðn robottisolujen pysðhdys- ja asetusaikoja ja nopeuttavan uusien robottiohjelmien kðytt——nottoa.
Robottisolut skannattiin 3D-kameralla ja skannauksen tuloksena saatuja 3D-malleja hy—dynnettiin solujen mittaamiseen. Mittojen perusteella rakennettiin simulointimallit FANUC ROBOGUIDE -simulointiohjelmistossa sekð valmiista ettð ty—n aikana mallinnetuista komponenteista. Joitain komponentteja ei voitu mallintaa, eikð niistð saatu ty—n aikana kðytt——n 3D-malleja. Ty—n aikana ohjelmoitiin ja simuloitiin kuvitteellinen esimerkkity—kierto yhdelle ty—ssð rakennetulle simulointimallille.
Opinnðytety—n lopputuloksena saatiin kolme simulointimallia ja esimerkkitoteutus ty—kierron simuloinnille toimeksiantajayrityksen kðytt——n. Simulointimallit vaativat kalibroinnin ja puuttuvat komponentit ennen kuin ne voidaan ottaa kðytt——n.";0;NO_INDICATION_OF_COLLABORATION;Simulointimallien rakentaminen robottisoluista;Seinajoen UAS;Leppðvuori, Aleksi;0;https://www.theseus.fi/handle/10024/888512;"[""No Nokia mention""]"
213;"Banking Sectors Role in SME Growth and Economic Development: A Comparative Study of Finland and Bangladesh This study looks at how financial institutions in Finland and Bangladesh support the growth of SMEs and the general economic development of both nations. In both rich and developing nations, SMEs have unique financial constraints despite playing a critical role in innovation, job creation, and long-term economic growth. This article examines the roles played by the banking industries in both nations, with a focus on financial products, online banking, laws, and financing programs for small and medium-sized businesses.
The research employs a mixed-methods approach, combining survey data with policy analysis and an extensive review of existing literature. These methods were used to assess how banking institutions function within their respective national contexts and how they affect SME access to finance. The study evaluates the extent and effectiveness of banking support mechanisms through both qualitative and quantitative lenses.
The findings demonstrate that Finland's banking sector is both technically advanced and inclusive, providing SMEs with strong institutional support and promoting business growth. Despite numerous positive advancements, Bangladesh's banking sector is beset by high interest rates, a lack of digital infrastructure, and insufficient law enforcement. The study concluded that three crucial componentsdigital innovation, readily accessible financial services, and regulatory strengthmust work together to guarantee the success of SME development. Additionally, it provides policy suggestions to financial stakeholders on how the banking industry may promote long-term, fair economic growth.";0;NO_INDICATION_OF_COLLABORATION;Banking Sectors Role in SME Growth and Economic Development: A Comparative Study of Finland and Bangladesh;Seinajoen UAS;Afrose, Sabeha;0;https://www.theseus.fi/handle/10024/889829;"[""No Nokia mention""]"
214;"Lean-johtamisen ja Agilen yhtðlðisyydet ja erot Tðssð opinnðytety—ssð selvitettiin Lean-johtamisen ja Agile-menetelmðn keskeisimpið yhtðlðisyyksið ja eroja asiakas-, henkil—st—-, talous- ja prosessinðk—kulmasta sekð millð tavoin ne tukevat organisaatioiden toimintaa.

Tutkimusmenetelmðnð kðytettiin kuvailevaa kirjallisuuskatsausta. Ty—tð lðhestyttiin narratiivisesta kulmasta kuvaillen suppeasti aiheen historiaa ja kehityskulmaa. Lðhteet valittiin hakusanojen, niiden relevanttiuden ja sisðll—n ajankohtaisuuden perusteella.

Lðpikðydyn kirjallisuuden perusteella voitiin tehdð johtopððt—s, ettð sekð Lean- johtamisessa ja Agilessa jaetaan samat keskeiset arvot, kuten asiakasarvon tuottaminen, jatkuvan parantaminen ja ihmisten osallistaminen. Molempia pidetððn ihmiskeskeisenð johtamistapana, joka perustuu luottamukseen ja henkil—st—n jatkuvaan oppimiseen ja kehittymiseen. Merkittðvið eroja l—ydettiin lðhestymistavoissa: Lean-johtamisessa painotettiin prosessien vakautta, standardointia ja tuotannon virtaavuutta, kun taas Agile- menetelmðllð korostettiin joustavuutta, nopeaa iterointia ja asiakaslðht—istð kehitystð. Johtopððt—ksenð voitiin todeta, ettð molemmissa, sekð Lean-johtamisessa ettð Agile- menetelmðllð, tuetaan organisaatioiden toimintaa ja niiden vahvuuksia yhdistðmðllð voidaan luoda hybridimalleja, joiden katsotaan muodostavan vahvan ja kestðvðn perustan nykyaikaiselle muutoskykyiselle johtamiselle.";0;NO_INDICATION_OF_COLLABORATION;Lean-johtamisen ja Agilen yhtðlðisyydet ja erot;Seinajoen UAS;Tammelin, Jesse;0;https://www.theseus.fi/handle/10024/892620;"[""No Nokia mention""]"
215;"Brðnditutkimus Seinðjoesta kokouskaupunkina Opinnðytety—n tarkoituksena oli tutkia Seinðjoen kaupungin sekð Seinðjoki Congress Oy:n brðndið potentiaalisten kokousjðrjestðjien keskuudessa. Opinnðytety—n ensimmðisenð tavoitteena oli perehtyð brðndiin ja brðndin rakentamiseen. Toisena tavoitteena oli toteuttaa tunnettuustutkimus liittyen Seinðjokeen sekð Seinðjoki Congress Oy:hyn.

Ty—n teoriaosuus kðsittelee brðndið ja brðndin rakentamista. Brðndin kðsite on laaja, eikð
sille ole olemassa yhtð oikeaa mððritelmðð. Brðndi on kaikkea sitð, millaisen kuvan ihmiset siitð saavat erilaisissa kohtaamisissa. Brðndi tuo yritykselle lisðarvoa ja auttaa asiakasta tekemððn valintoja. Teoriaosuudessa kðydððn lðpi brðndin merkitystð ja
tehtðvið, brðndin identiteetti, brðndiviestintð, brðndin analyysit ja kuinka brðndið voidaan tutkia.

Tutkimus toteutettiin kvantitatiivisena tutkimuksena. Tutkimusaineisto kerðttiin Webropolkyselyn avulla. Kyselyn avulla kartoitettiin, millaiset organisaatiot siihen vastaavat ja mitð niiden keskuudessa Seinðjoesta ajatellaan esimerkiksi sijainnin sekð kokous- ja tapahtumamahdollisuuksien osalta. Kyselyyn saatiin 57 vastausta erilaisista organisaatioista, kuten yrityksistð, jðrjest—istð ja liitoista.

Tutkimustulosten perusteella Seinðjokea pidetððn yrittðjðhenkisenð, aktiivisena ja monipuolisena kaupunkina. Seinðjoen sijainti tunnetaan hyvin, ja siihen yhdistetððn esimerkiksi nðhtðvyydet ja siellð jðrjestettðvðt tapahtumat. Toimeksiantajan tunnettuus vastaajien keskuudessa oli pientð, mutta tutkimustulosten avulla saatiin kartoitettua,
kuinka hyvin ja millð tavoin yrityksen markkinointi on ollut onnistunutta.

Tutkimustulosten avulla toimeksiantaja saa suuntaa antavia tietoja siitð, miten houkutteleva Seinðjoki on tapahtuma- ja kokouskaupunkina ja mitð siitð ajatellaan.";0;NO_INDICATION_OF_COLLABORATION;Brðnditutkimus Seinðjoesta kokouskaupunkina;Seinajoen UAS;Rauma, Elina;0;https://www.theseus.fi/handle/10024/888452;"[""No Nokia mention""]"
216;"Organisoituminen tuotekehitysliiketoiminnassa: case-tutkimus IT-yrityksen keskijohdon kokemuksista Tðssð ty—ssð perehdytððn ja kehitetððn kohdeyrityksen organisoitumista ja organisaatiomuutosta. Ty—n teoreettisena taustana toimii tutustuminen organisaatiomuutokseen, eri organisaatiomalleihin, toimintaan matriisiorganisaatiossa ja kyseisen organisaatiomallin hyviin ja huonoihin puoliin. Kohdeyritys toimii informaatioteknologian ja tietoturvan liiketoiminnassa ja tuottaa projektimaisella toiminnalla omia tuotteita korkeaa tietoturvaa vaativiin ympðrist—ihin. 

Ty— on toteutettu kvalitatiivisena tutkimuksena. Laadullisessa tutkimuksessa asetetaan lðht—kohta epðilyksen alaiseksi ja tarjotaan tapa ymmðrtðð tutkimuksen kohdetta. Perustutkimuksessa tutustuttiin erilaisiin organisaatiorakenteisiin, organisaatiomuutokseen ja erityisesti toimintaan matriisiorganisaatiossa. Tðtð tietoa kðytettiin hyvðksi teemahaastattelurunkoa luodessa ja itse haastatteluita suoritettaessa. Tutkimusjoukkona toimi 11 kohdeyrityksen keskijohtoon tai tekniseen johtoon kuuluvaa henkil—ð. Aineisto analysoitiin sisðll—nanalyysillð, ja pððkohdat otettiin jatkotoimenpiteiden kohteeksi. 

Tuloksista pystyttiin havainnoimaan useita tehostamisen ja kirkastamisen kohteita organisaatiomuutoksessa ja organisaation toiminnassa. Haastatteluiden tuloksista ja kirjallisuuden tarjoamista ohjeista luotiin ohjeita muutosprosessiin, yhti—n sisðiseen vastuunjakoon, kommunikointiin eri tasoilla ja yhteisen toimintatavan luomiseen. Lisðksi ty—ssð esitetððn keinoja yhteisen tahtotilan ja sitð tukevan johtajuuden aikaansaamiseen. Oletuksena on, ettð ty—ssð esitetyt keinot vðhentðvðt epðselvyyttð ja auttavat yhti—n tavoitteiden saamisessa yhteisty—ssð.";0;NO_INDICATION_OF_COLLABORATION;Organisoituminen tuotekehitysliiketoiminnassa: case-tutkimus IT-yrityksen keskijohdon kokemuksista;Seinajoen UAS;Uitto, Juha;0;https://www.theseus.fi/handle/10024/891019;"[""No Nokia mention""]"
217;"Kokemustiedon hy—dyntðminen Pirkanmaan hyvinvointialueen vammaissosiaality—ssð Opinnðytety—ssð tutkittiin Pirkanmaan hyvinvointialueen vammaissosiaality—n ty—ntekij—iden kokemuksia ja nðkemyksið kokemustiedon hy—dyntðmisestð. Tavoitteena oli selvittðð, miten kokemustietoa sekð kokemustoimijoiden ja -asiantuntijoiden osaamista hy—dynnetððn vammaissosiaality—n palveluissa sekð tekij—itð, jotka mahdollisesti tukevat tai estðvðt sen kðytt—ð. Opinnðytety—ssð tarkasteltiin my—s kokemustiedon hy—dyntðmistð harvinaissairaiden ja -vammaisten osalta. Ty—n tarkoituksena oli kartoittaa kokemustiedon hy—dyntðmisen tasoja, kehittðmistarpeita sekð tuottaa tietoa kðytðnn—istð ja haasteista. Yhteisty—tahona toimi HARSO ry, harvinaissairaiden ja vammaisten kattojðrjest—.

Opinnðytety— toteutettiin laadullisena tutkimuksena, jossa hy—dynnettiin my—s monimenetelmðtutkimuksen lðhestymistapaa. Tutkimuksen kohderyhmðnð olivat Pirkanmaan hyvinvointialueen vammaissosiaality—n vastuualueen ty—ntekijðt. Tutkimusaineisto kerðttiin verkkokyselyllð Webropol-alustalla. Analyysimenetelmðnð kðytettiin teemoittelua, jonka avulla aineistosta nousivat pððteemoiksi kokemustiedon kðytt—, kokemustiedon hy—dyntðmisen edellytykset sekð koulutus ja tietoisuus. Nðmð kolme pððteemaa jakautuivat kuuteen alateemaan, joiden my—tð tarkasteltiin yksityiskohtaisemmin kokemustiedon roolia, nykytilaa, estðvið ja tukevia tekij—itð sekð tarvittavaa koulutusta ja tietoisuutta.

Tutkimustulokset osoittivat, ettð kokemustiedon hy—dyntðminen Pirkanmaan hyvinvointialueen vammaissosiaality—ssð on tðllð hetkellð alihy—dynnetty resurssi, ja sen kðytt— vaihtelee merkittðvðsti ty—ntekij—iden vðlillð. Tulosten mukaan kokemustiedon hy—dyntðmistð tukevat erityisesti ty—ntekij—iden avoimuus, arvostus kokemustietoa ja -toimijoita kohtaan sekð organisaation tuki. Merkittðviksi esteiksi kokemustiedon hy—dyntðmiselle tuloksista nousivat resurssipula, asenteet ja ennakkoluulot. Kehittðmistarpeina tunnistettiin koulutuksen lisððminen, tiedon saatavuuden parantaminen, yhteisty—n lisððminen jðrjest—jen ja organisaatioiden kanssa sekð selkeiden yhteisten ohjeiden luominen. Tulokset korostivat vahvan organisaation tuen merkitystð, joka koettiin ratkaisevaksi kokemustiedon integroimiseksi kðytðnt—ihin. Kokemustiedolla nðhtiin olevan my—s tðrkeð rooli harvinaissairauksia tai vammoja omaavien asiakkaiden palveluissa, sillð se mahdollistaa syvemmðn ymmðrryksen niin asiakkaan sairaudesta ja arjesta kuin elðmðnhaasteista.";0;NO_INDICATION_OF_COLLABORATION;Kokemustiedon hy—dyntðminen Pirkanmaan hyvinvointialueen vammaissosiaality—ssð;Seinajoen UAS;Lðykki, Merja;0;https://www.theseus.fi/handle/10024/885788;"[""No Nokia mention""]"
